group_id,leader,member,modify_leader,image_url,label,canonical leader,brand,name,package ,promotion
870,do pinos leche homogenizada do pinos 1.8 litro,do pinos leche homogenizada do pinos 1.8 litro,Yes,,True ,Dos Pinos leche homogenizada 1.8 L,Dos Pinos,leche homogenizada,1.8 L,0
871,do pinos leche homogenizada do pinos litro,do pinos leche homogenizada do pinos litro,Yes,,True ,Dos Pinos leche homogenizada 1 L,Dos Pinos,leche homogenizada,1 L,0
872,do pinos leche saborizada uht 50 % proteina chocoalm 250 ml,do pinos leche saborizada uht 50 % proteina chocoalm 250 ml,Yes,,True ,Dos Pinos leche saborizada uht 50% proteína choco almendras 250 ml,Dos Pinos,leche saborizada uht 50% proteína choco almendras,250 ml,0
873,do pinos leche semi descremada do pinos litro,do pinos leche descremada do pinos litro,Yes,,False ,Dos Pinos leche descremada 1 L,Dos Pinos,leche descremada,1 L,0
873,do pinos leche semi descremada do pinos litro,do pinos leche semi descremada do pinos litro,Yes,,True ,Dos Pinos leche semi descremada 1 L,Dos Pinos,leche semi descremada,1 L,0
874,do pinos leche semidescremada delactomy do pinos litro,do pinos leche semidescremada delactomy do pinos litro,Yes,,TRUE,Dos Pinos Leche semidescremada Caja 1 L,Dos Pinos,Leche semidescremada,Caja 1 L,0
875,do pinos leche uht delactosada 0 % 50 % proteina vainilla 250ml,do pinos delactomy leche uht 0 % doble proteina caja 500,Yes,,FALSE,Dos Pinos Leche deslactosada vainila más proteína Caja 500 ml,Dos Pinos,Leche deslactosada vainila más proteína,Caja 500 ml,0
875,do pinos leche uht delactosada 0 % 50 % proteina vainilla 250ml,do pinos leche uht delactosada 0 % 50 % proteina 250 ml,Yes,,FALSE,Dos Pinos Leche deslactosada más proteína Caja 250 ml,Dos Pinos,Leche deslactosada más proteína,Caja 250 ml,0
875,do pinos leche uht delactosada 0 % 50 % proteina vainilla 250ml,do pinos leche uht delactosada 0 % 50 % proteina vainilla 250ml,Yes,,TRUE,Dos Pinos Leche deslactosada Cartón 250 ml,Dos Pinos,Leche deslactosada,Cartón 250 ml,0
876,do pinos leche uht delactosada 0 % doble protena 500ml,do pinos leche uht delactosada 0 % doble protena 500ml,Yes,,TRUE,Dos Pinos Leche deslactosada Cartón 500 ml,Dos Pinos,Leche deslactosada,Cartón 500 ml,0
877,do pinos mantequilla csal 62.5 gr,do pinos mantequilla csal 62.5 gr,Yes,,TRUE,Dos Pinos Mantequilla con sal Empaque 62 g,Dos Pinos,Mantequilla con sal,Empaque 62 g,0
879,do pinos mantequlla in line taza 210 gr,do pinos mantequlla in line taza 210 gr,Yes,,TRUE,Dos Pinos Mantequilla light Empaque 210 g,Dos Pinos,Mantequilla light,Empaque 210 g,0
880,do pinos mortadela pollo 375,do pinos mortadela pollo 375,Yes,,TRUE,Dos Pinos Mortadela pollo Empaque 375 g,Dos Pinos,Mortadela pollo,Empaque 375 g,0
882,do pinos natilla con sal delactomy do pinos 400 grs,do pinos natilla con sal delactomy do pinos 400 grs,Yes,,TRUE,Dos Pinos Natilla con sal Delactomy Doypack 400 g,Dos Pinos,Natilla con sal Delactomy,Doypack 400 g,0
885,do pinos natilla granja 115 gr,do pinos natilla granja 115 gr,Yes,,TRUE,Dos Pinos Natilla La Granja Empaque 115 g,Dos Pinos,Natilla La Granja,Empaque 115 g,0
888,do pinos nctar mixto frutas lt tb,do pinos nctar mixto frutas lt tb,Yes,,TRUE,Dos Pinos Néctar mixto de frutas Caja 1 L,Dos Pinos,Néctar mixto de frutas,Caja 1 L,0
889,do pinos nctar uht surtido 6 pack,do pinos nctar uht surtido 6 pack,Yes,,TRUE,Dos Pinos Néctar de frutas surtido 6 x 200 ml,Dos Pinos,Néctar de frutas surtido,6 x 200 ml,0
890,do pinos queque helado do pinos 100 grs,do pinos helado trits do pinos 100 grs,Yes,,FALSE,Dos Pinos Helado Trits Empaque 100 g,Dos Pinos,Helado Trits,Empaque 100 g,0
890,do pinos queque helado do pinos 100 grs,do pinos queque helado do pinos 100 grs,Yes,,TRUE,Dos Pinos Helado Empaque 100 g,Dos Pinos,Helado,Empaque 100 g,0
891,do pinos queso cheddar rallado 225g,do pinos queso cheddar rallado 225g,Yes,,TRUE,Dos Pinos Queso cheddar rallado Empaque 225 g,Dos Pinos,Queso cheddar rallado,Empaque 225 g,0
892,do pinos queso cottage 310 gr desc 30 %,do pinos queso cottage 310 gr desc 30 %,Yes,,TRUE,Dos Pinos Queso cottage Pote 310 g,Dos Pinos,Queso cottage,Pote 310 g,1
894,do pinos queso crema pia taza 210 g,do pinos queso crema pia taza 210 g,Yes,,TRUE,Dos Pinos Queso crema sabor piña Empaque 210 g,Dos Pinos,Queso crema sabor piña,Empaque 210 g,0
896,do pinos queso fresco semiduro protena 300 gr,do pinos queso fresco semiduro protena 300 gr,Yes,,TRUE,Dos Pinos Queso fresco semiduro Empaque 300 g,Dos Pinos,Queso fresco semiduro,Empaque 300 g,0
897,do pinos queso gouda 200 gr desc 30 %,do pinos queso gouda 200 gr desc 30 %,Yes,,TRUE,Dos Pinos Queso gouda Empaque 200 g,Dos Pinos,Queso gouda,Empaque 200 g,1
898,do pinos queso mozarella do pinos paquete 128 grs,do pinos queso mozarella do pinos paquete 128 grs,Yes,,TRUE,Dos Pinos Queso mozarella Empaque 128 g,Dos Pinos,Queso mozarella,Empaque 128 g,0
900,do pinos queso procesado 8 unid do pinos,do pinos queso procesado 8 unid do pinos,Yes,,TRUE,Dos Pinos Queso procesado Empaque 8 unid,Dos Pinos,Queso procesado,Empaque 8 unid,0
902,do pinos queso procesado do pinos 12 unidades,do pinos queso procesado do pinos 12 unidades,Yes,,TRUE,Dos Pinos Queso procesado Empaque 12 unid,Dos Pinos,Queso procesado,Empaque 12 unid,0
903,do pinos queso procesado mozarella 192 gr 12 rebanadas,do pinos queso procesado mozarella 192 gr 12 rebanadas,Yes,,TRUE,Dos Pinos Queso procesado Empaque 12 unid,Dos Pinos,Queso procesado,Empaque 12 unid,0
906,do pinos rebanaditas la granja 192g 12 rebanadas,do pinos rebanaditas la granja 192g 12 rebanadas,Yes,,TRUE,Dos Pinos Rebanaditas La Granja Empaque 12 unid,Dos Pinos,Rebanaditas La Granja,Empaque 12 unid,0
908,do pinos rompope choco whisky tetra pak 1l,do pinos rompope choco whisky tetra pak 1l,Yes,,TRUE,Dos Pinos Rompope choco whisky Caja 1 L,Dos Pinos,Rompope choco whisky,Caja 1 L,0
909,do pinos rompope chocowhisky caja 1 l,do pinos rompope chocowhisky caja 1 l,Yes,,TRUE,Dos Pinos Rompope choco whisky Caja 1 L,Dos Pinos,Rompope choco whisky,Caja 1 L,0
910,do pinos rompope do pinos litro,do pinos rompope do pinos litro,Yes,,TRUE,Dos Pinos Rompope Caja 1 L,Dos Pinos,Rompope,Caja 1 L,0
911,do pinos rompope tetra pak 1l,do pinos rompope tetra pak 1l,Yes,,TRUE,Dos Pinos Rompope Caja 1 L,Dos Pinos,Rompope,Caja 1 L,0
912,do pinos t blanco cero 2.2 lt desc 19 %,do pinos t blanco cero 2.2 lt desc 19 %,Yes,,TRUE,Dos Pinos Té blanco cero Botella 2.2 L,Dos Pinos,Té blanco cero,Botella 2.2 L,1
913,do pinos t limn 2.2 lt botella desc 19 %,do pinos t limn 2.2 lt botella desc 19 %,Yes,,TRUE,Dos Pinos Té de limón Botella 2.2 L,Dos Pinos,Té de limón,Botella 2.2 L,1
914,do pinos te acompaa en tu desayuno,do pinos te acompaa en tu desayuno,Yes,,TRUE,Dos Pinos Te acompaña en tu desayuno ,Dos Pinos,Te acompaña en tu desayuno,,0
915,do pinos te melocoton cero 2.2 botella desc 19 %,do pinos te melocoton cero 2.2 botella,Yes,,FALSE,Dos Pinos Té melocotón cero Botella 2.2 L,Dos Pinos,Té melocotón cero,Botella 2.2 L,0
915,do pinos te melocoton cero 2.2 botella desc 19 %,do pinos te melocoton cero 2.2 botella desc 19 %,Yes,,TRUE,Dos Pinos Té melocotón cero Botella 2.2 L,Dos Pinos,Té melocotón cero,Botella 2.2 L,0
916,do pinos te verde relajacion 500 ml,do pinos te verde relajacion 500 ml,Yes,,TRUE,Dos Pinos Té verde relajación Botella 500 ml,Dos Pinos,Té verde relajación,Botella 500 ml,0
918,do pinos yogurt batido griego original 500 gr desc 30 %,do pinos yogurt batido griego original 500 g taza,Yes,,FALSE,Dos Pinos Yogurt batido griego original Empaque 500 g,Dos Pinos,Yogurt batido griego original,Empaque 500 g,0
918,do pinos yogurt batido griego original 500 gr desc 30 %,do pinos yogurt batido griego original 500 gr desc 30 %,Yes,,TRUE,Dos Pinos Yogurt batido griego original Pote 500 g,Dos Pinos,Yogurt batido griego original,Pote 500 g,1
919,do pinos yogurt batido in line pia colada 125 gr,do pinos yogurt batido in line pia colada 125 gr,Yes,,TRUE,Dos Pinos Yogurt batido light piña colada Empaque 125 g,Dos Pinos,Yogurt batido light piña colada,Empaque 125 g,0
921,do pinos yogurt c topping arandano deligurt do pinos 190 grs,do pinos yogurt c topping arandano deligurt do pinos 190 grs,Yes,,TRUE,Dos Pinos Yogurt con topping arándano Deligurt Empaque 190 g,Dos Pinos,Yogurt con topping arándano Deligurt,Empaque 190 g,0
923,do pinos yogurt fresa c topping chocolate do pinos 170 grs,do pinos yogurt fresa c topping chocolate do pinos 170 grs,Yes,,TRUE,Dos Pinos Yogurt fresa con topping chocolate Empaque170 g,Dos Pinos,Yogurt fresa con topping chocolate,Empaque170 g,0
924,do pinos yogurt fresa con granola pasas do pinos 170 grs,do pinos yogurt fresa con granola pasas do pinos 170 grs,Yes,,TRUE,Dos Pinos Yogurt fresa con granola y pasas Empaque170 g,Dos Pinos,Yogurt fresa con granola y pasas,Empaque170 g,0
925,do pinos yogurt fresa con topping de chocolate,do pinos yogurt fresa con topping de chocolate,Yes,,TRUE,Dos Pinos Yogurt fresa con topping de chocolate ,Dos Pinos,Yogurt fresa con topping de chocolate,,0
927,do pinos yogurt griego arandano deligurt 150 grs,do pinos yogurt griego arandano deligurt 150 grs,Yes,,TRUE,Dos Pinos Yogurt griego arándano Deligurt Empaque 150 g,Dos Pinos,Yogurt griego arándano Deligurt,Empaque 150 g,0
931,do pinos yogurt lquido griego plus fresa banano 750 ml,do pinos yogurt lquido griego plus coco 750 ml,Yes,,FALSE,Dos Pinos Yogurt líquido griego plus coco Botella 750 ml,Dos Pinos,Yogurt líquido griego plus coco,Botella 750 ml,0
931,do pinos yogurt lquido griego plus fresa banano 750 ml,do pinos yogurt lquido griego plus fresa banano 750 ml,Yes,,TRUE,Dos Pinos Yogurt líquido griego plus fresa banano Botella 750 ml,Dos Pinos,Yogurt líquido griego plus fresa banano,Botella 750 ml,0
933,do pinos zarcero queso turrialba 340 g,do pinos zarcero queso turrialba 340 g,Yes,,TRUE,Dos Pinos Queso zarcero Turrialba Empaque 340 g,Dos Pinos,Queso zarcero Turrialba,Empaque 340 g,0
1429,dos pinos  leche sabor vainilla caja 250 ml,do pinos frescoleche tapita 250 ml,No,,FALSE,Dos Pinos Frescoleche Tapita Caja 250 ml,Dos Pinos,Frescoleche Tapita,Caja 250 ml,0
1429,dos pinos  leche sabor vainilla caja 250 ml,do pinos frescoleche vainilla 250 ml,No,,FALSE,Dos Pinos Frescoleche vainilla Caja 250 ml,Dos Pinos,Frescoleche vainilla,Caja 250 ml,0
1429,dos pinos  leche sabor vainilla caja 250 ml,fresco leche vainilla do pinos 250 ml 7010 4.2,No,,FALSE,Dos Pinos Frescoleche vainilla Caja 250 ml,Dos Pinos,Frescoleche vainilla,Caja 250 ml,0
955,dos pinos bebida iced capuccino britt 250 ml,do pinos cafe fro capuccino britt 250 ml uht,No,,FALSE,Dos Pinos Café frío capuccino Britt  Vaso 250 ml,Dos Pinos,Café frío capuccino Britt ,Vaso 250 ml,0
965,dos pinos deligurt arándano 750 ml,deligurt arndano do pinos 750 ml 2245 7.5,No,,FALSE,Dos Pinos Yogurt arándano Deligurt Botella 750 ml,Dos Pinos,Yogurt arándano Deligurt,Botella 750 ml,0
2962,dos pinos deligurt frutas 200 ml,do pinos deligurt melocoton 200 ml,No,,FALSE,Dos Pinos Yogurt melocotón Deligurt Botella 200 ml,Dos Pinos,Yogurt melocotón Deligurt,Botella 200 ml,0
2962,dos pinos deligurt frutas 200 ml,do pinos yogurt arandano deligurt 200 ml,No,,FALSE,Dos Pinos Yogurt arándano Deligurt Botella 200 ml,Dos Pinos,Yogurt arándano Deligurt,Botella 200 ml,0
2962,dos pinos deligurt frutas 200 ml,do pinos yogurt delactomy fresa 200 ml,No,,FALSE,Dos Pinos Yogurt fresa Delactomy Botella 200 ml,Dos Pinos,Yogurt fresa Delactomy,Botella 200 ml,0
2962,dos pinos deligurt frutas 200 ml,do pinos yogurt fresa deligurt 200 ml,No,,FALSE,Dos Pinos Yogurt fresa Deligurt Botella 200 ml,Dos Pinos,Yogurt fresa Deligurt,Botella 200 ml,0
2962,dos pinos deligurt frutas 200 ml,do pinos yogurt frutas deligurt 200 ml,No,,FALSE,Dos Pinos Yogurt frutas Deligurt Botella 200 ml,Dos Pinos,Yogurt frutas Deligurt,Botella 200 ml,0
2962,dos pinos deligurt frutas 200 ml,do pinos yogurt melocoton deligurt 200 ml,No,,FALSE,Dos Pinos Yogurt melocotón Deligurt Botella 200 ml,Dos Pinos,Yogurt melocotón Deligurt,Botella 200 ml,0
2962,dos pinos deligurt frutas 200 ml,yogurt arandano deligurt do pinos 200 ml,No,,FALSE,Dos Pinos Yogurt arándano Deligurt Botella 200 ml,Dos Pinos,Yogurt arándano Deligurt,Botella 200 ml,0
2962,dos pinos deligurt frutas 200 ml,yogurt delactomy de fresa do pinos 200 ml 3129 5,No,,FALSE,Dos Pinos Yogurt fresa Delactomy Botella 200 ml,Dos Pinos,Yogurt fresa Delactomy,Botella 200 ml,0
2962,dos pinos deligurt frutas 200 ml,yogurt fresa deligurt do pinos 200 ml,No,,FALSE,Dos Pinos Yogurt fresa Deligurt Botella 200 ml,Dos Pinos,Yogurt fresa Deligurt,Botella 200 ml,0
969,dos pinos deligurt in line arándanos 200 ml,deligurt in line de arndanos do pinos 200 ml 6778 5,No,,FALSE,Dos Pinos Yogurt arándanos light Deligurt Botella 200 ml,Dos Pinos,Yogurt arándanos light Deligurt,Botella 200 ml,0
970,dos pinos deligurt in line de fresa 125 g,deligurt griego arndano light do pinos 150 g 0089,No,,FALSE,Dos Pinos Yogurt griego arándano light Deligurt Pote 150 g,Dos Pinos,Yogurt griego arándano light Deligurt,Pote 150 g,0
970,dos pinos deligurt in line de fresa 125 g,deligurt griego de fresa light do pinos 150 g 0874,No,,FALSE,Dos Pinos Yogurt griego de fresa light Pote 150 g,Dos Pinos,Yogurt griego de fresa light,Pote 150 g,0
970,dos pinos deligurt in line de fresa 125 g,deligurt in line de fresa do pinos 125 g 4811 7.5,No,,FALSE,Dos Pinos Yogurt de fresa light Deligurt Pote 125 g,Dos Pinos,Yogurt de fresa light Deligurt,Pote 125 g,0
970,dos pinos deligurt in line de fresa 125 g,do pinos deligurt batido frutas 125 g,No,,FALSE,Dos Pinos Yogurt batido frutas Deligurt Pote 125 g,Dos Pinos,Yogurt batido frutas Deligurt,Pote 125 g,0
970,dos pinos deligurt in line de fresa 125 g,do pinos deligurt batido griego arandano light 150 gr,No,,FALSE,Dos Pinos Yogurt batido griego arándano light Deligurt Pote 150 g,Dos Pinos,Yogurt batido griego arándano light Deligurt,Pote 150 g,0
970,dos pinos deligurt in line de fresa 125 g,do pinos deligurt batido griego fresa 150 gr,No,,FALSE,Dos Pinos Yogurt batido griego fresa Deligurt Pote 150 g,Dos Pinos,Yogurt batido griego fresa Deligurt,Pote 150 g,0
970,dos pinos deligurt in line de fresa 125 g,do pinos deligurt batido griego light fresa 150 gr,No,,FALSE,Dos Pinos Yogurt batido griego light fresa Deligurt Pote  150 g,Dos Pinos,Yogurt batido griego light fresa Deligurt,Pote  150 g,0
970,dos pinos deligurt in line de fresa 125 g,do pinos deligurt batido griego original 150 gr,No,,FALSE,Dos Pinos Yogurt batido griego original Pote 150 g,Dos Pinos,Yogurt batido griego original,Pote 150 g,0
970,dos pinos deligurt in line de fresa 125 g,do pinos deligurt batido in line fresa 125 g,No,,FALSE,Dos Pinos Yogurt batido fresa light Deeligurt Pote 125 g,Dos Pinos,Yogurt batido fresa light Deeligurt,Pote 125 g,0
972,dos pinos deligurt topping con coco 150 g,deligurt topping coco do pinos 150 g 6136 10,No,,FALSE,Dos Pinos Yogurt con topping coco Deligurt Pote 150 g,Dos Pinos,Yogurt con topping coco Deligurt,Pote 150 g,0
972,dos pinos deligurt topping con coco 150 g,do pinos deligurt batido topping coco 150 gr,No,,FALSE,Dos Pinos Yogurt batido con topping coco Pote 150 g,Dos Pinos,Yogurt batido con topping coco,Pote 150 g,0
973,dos pinos dip cebolla francesa 230 g,dip cebolla francesa do pinos 230 g 8179 10.2,No,,FALSE,Dos Pinos Dip cebolla francesa Empaque 230 g,Dos Pinos,Dip cebolla francesa,Empaque 230 g,0
973,dos pinos dip cebolla francesa 230 g,do pinos dip de cebolla francesa do pinos 230 grs,No,,FALSE,Dos Pinos Dip cebolla francesa Empaque 230 g,Dos Pinos,Dip cebolla francesa,Empaque 230 g,0
976,dos pinos dip jamónn serrano 210 g,do pinos dip jamn serrano 201 gr taza desc 18 %,No,,FALSE,Dos Pinos Dip jamón serrano Empaque 201 g,Dos Pinos,Dip jamón serrano,Empaque 201 g,0
976,dos pinos dip jamónn serrano 210 g,do pinos dip jamn serrano 210 gr desc 18 %,No,,FALSE,Dos Pinos Dip jamón serrano Empaque 210 g,Dos Pinos,Dip jamón serrano,Empaque 210 g,1
976,dos pinos dip jamónn serrano 210 g,do pinos dip jamon serrano 210 g,No,,FALSE,Dos Pinos Dip jamón serrano Empaque 210 g,Dos Pinos,Dip jamón serrano,Empaque 210 g,0
975,dos pinos dip sabor chipotle 210 g,do pinos dip chipotle 210 g,No,,FALSE,Dos Pinos Dip chipotle Empaque 210 g,Dos Pinos,Dip chipotle,Empaque 210 g,0
977,dos pinos dip salmón ahumado 210 g,dip salmn ahumado do pinos 210 g 5473 10.3,No,,FALSE,Dos Pinos Dip salmón ahumado Empaque 210 g,Dos Pinos,Dip salmón ahumado,Empaque 210 g,0
1426,dos pinos fresco leche sabor chocolate 250 ml,do pinos frescoleche chocolate 250 ml,No,,FALSE,Dos Pinos Frescoleche chocolate Caja 250 ml,Dos Pinos,Frescoleche chocolate,Caja 250 ml,0
1426,dos pinos fresco leche sabor chocolate 250 ml,fresco leche chocolate do pinos 250 ml 5009 4.2,No,,FALSE,Dos Pinos Frescoleche chocolate Caja 250 ml,Dos Pinos,Frescoleche chocolate,Caja 250 ml,0
1428,dos pinos fresco leche sabor fresa 250 ml,do pinos frescoleche fresa 250 ml,No,,FALSE,Dos Pinos Frescoleche fresa Caja 250 ml,Dos Pinos,Frescoleche fresa,Caja 250 ml,0
1428,dos pinos fresco leche sabor fresa 250 ml,fresco leche fresa do pinos 250 ml 7027 4.2,No,,FALSE,Dos Pinos Frescoleche fresa Caja 250 ml,Dos Pinos,Frescoleche fresa,Caja 250 ml,0
989,dos pinos helado baileys pote 540 g,do pinos helado bailey 540 gr,No,,FALSE,Dos Pinos Helado sabor bailey's  Pote 540 g,Dos Pinos,Helado sabor bailey's ,Pote 540 g,0
1669,dos pinos helado deleite caramel fudge pote 565 g,helado deleite caramelo do pinos 565 g 0530 12,No,,FALSE,Dos Pinos Helado deleite caramelo Pote 565 g,Dos Pinos,Helado deleite caramelo,Pote 565 g,0
1672,dos pinos helado deleite naranja holandesa pote 565 g,helado deleite naranja holandesa do pinos 565 g 0516 12,No,,FALSE,Dos Pinos Helado deleite naranja holandesa Pote 565 g,Dos Pinos,Helado deleite naranja holandesa,Pote 565 g,0
1689,dos pinos helado milán menta pote 540 g,helado milan menta do pinos 540 gr,No,,FALSE,Dos Pinos Helado milan menta Pote 540 g,Dos Pinos,Helado milan menta,Pote 540 g,0
2117,dos pinos helado mini sandwich pote 570 g,na helado mini sandwich do pinos 570 gr,No,,FALSE,Dos Pinos Helado mini sandwich Pote 570 g,Dos Pinos,Helado mini sandwich,Pote 570 g,0
1710,dos pinos helado naranja holandesa trits 100 g,helado trits naranja holandesa do pinos 100 g 7682 10,No,,FALSE,Dos Pinos Helado naranja holandesa Trits Empaque 100 g,Dos Pinos,Helado naranja holandesa Trits,Empaque 100 g,0
1701,dos pinos helado sundae pote 110 g,helado sundae caramelo do pinos 136 g 0295 9,No,,FALSE,Dos Pinos Helado sundae caramelo Empaque 136 g,Dos Pinos,Helado sundae caramelo,Empaque 136 g,0
1711,dos pinos helado trits pie de limón pote 100 g,helado trits pie de limn do pinos 100 g 9860 10,No,,FALSE,Dos Pinos Helado pie de limón Trits Empaque 100 g,Dos Pinos,Helado pie de limón Trits,Empaque 100 g,0
1063,dos pinos jugo de naranja botella 2.2 l,do pinos jugo de naranja do pinos 2.2 lts botella,No,,FALSE,Dos Pinos Jugo de naranja Botella 2.2 L,Dos Pinos,Jugo de naranja,Botella 2.2 L,0
1847,dos pinos jugo de naranja caja 1.8 l,jugo naranja do pinos 1.8 l 9274 10,No,,FALSE,Dos Pinos Jugo de naranja Botella 1.8 L,Dos Pinos,Jugo de naranja,Botella 1.8 L,0
1845,dos pinos jugo naranja 100% natural botella 1.8 l,do pinos jugo de naranja 100 % do pinos natural 1.8 lts,No,,FALSE,Dos Pinos Jugo de naranja 100% natural Botella 1.8 L,Dos Pinos,Jugo de naranja 100% natural,Botella 1.8 L,0
1845,dos pinos jugo naranja 100% natural botella 1.8 l,do pinos jugo de naranja 100 % natural1.8 lt,No,,FALSE,Dos Pinos Jugo de naranja 100% natural Botella 1.8 L,Dos Pinos,Jugo de naranja 100% natural,Botella 1.8 L,0
1845,dos pinos jugo naranja 100% natural botella 1.8 l,jugo de naranja 100 % do pinos natural 1.8 lts,No,,FALSE,Dos Pinos Jugo de naranja 100% natural Botella 1.8 L,Dos Pinos,Jugo de naranja 100% natural,Botella 1.8 L,0
1845,dos pinos jugo naranja 100% natural botella 1.8 l,jugo naranja 100 % natural do pinos 1.8 l 2525,No,,FALSE,Dos Pinos Jugo de naranja 100% natural Botella 1.8 L,Dos Pinos,Jugo de naranja 100% natural,Botella 1.8 L,0
1845,dos pinos jugo naranja 100% natural botella 1.8 l,jugo naranja 100 % natural do pinos 1.8 l 9069 10,No,,FALSE,Dos Pinos Jugo de naranja 100% natural Botella 1.8 L,Dos Pinos,Jugo de naranja 100% natural,Botella 1.8 L,0
1075,dos pinos lactocrema 115 g,do pinos lactocrema 115 grs,No,,FALSE,Dos Pinos Lactocrema Empaque 115 g,Dos Pinos,Lactocrema,Empaque 115 g,0
1076,dos pinos lactocrema pote 210 g,do pinos lactocrema taza 210 gr,No,,FALSE,Dos Pinos Lactocrema Empaque 210 g,Dos Pinos,Lactocrema,Empaque 210 g,0
1965,dos pinos leche delactomy en polvo 400 g,leche descremada en polvo do pinos 400 g 2039 7,No,,FALSE,Dos Pinos Leche descremada en polvo Bolsa 400 g,Dos Pinos,Leche descremada en polvo,Bolsa 400 g,0
1965,dos pinos leche delactomy en polvo 400 g,leche en polvo delactomy do pinos 400 g 2206 7,No,,FALSE,Dos Pinos Leche en polvo Delactomy do pinos 400 g 2206 7 Bolsa 400 g,Dos Pinos,Leche en polvo Delactomy do pinos 400 g 2206 7,Bolsa 400 g,0
1952,dos pinos leche delactomy fresa caja 250 ml,leche delactomy fresa do pinos 250 ml 7348 4.2,No,,FALSE,Dos Pinos Leche sabor fresa Delactomy Caja 250 ml,Dos Pinos,Leche sabor fresa Delactomy,Caja 250 ml,0
1954,dos pinos leche delactomy vainilla caja 250 ml,leche delactomy vainilla do pinos 250 ml 7355 4.2,No,,FALSE,Dos Pinos Leche sabor vainilla Caja 250 ml,Dos Pinos,Leche sabor vainilla,Caja 250 ml,0
1956,dos pinos leche descremada vainilla +proteína cartón 250 ml,do pinos leche descremada 250 ml,No,,FALSE,Dos Pinos Leche descremada Caja 250 ml,Dos Pinos,Leche descremada,Caja 250 ml,0
1956,dos pinos leche descremada vainilla +proteína cartón 250 ml,leche descremada do pinos 250 ml 1163 4.2,No,,FALSE,Dos Pinos Leche descremada Caja 250 ml,Dos Pinos,Leche descremada,Caja 250 ml,0
1958,dos pinos leche in line descremada caja 1 l,leche descremada do pinos 1 l 1156 7.2,No,,FALSE,Dos Pinos Leche descremada Caja 1 L,Dos Pinos,Leche descremada,Caja 1 L,0
1958,dos pinos leche in line descremada caja 1 l,leche deslactosada tb do pinos descremada 1 l 8644 7.2,No,,FALSE,Dos Pinos Leche deslactosada descremada Caja 1 L,Dos Pinos,Leche deslactosada descremada,Caja 1 L,0
1968,dos pinos leche pinito entera en polvo bolsa 400 g,do pinos leche en polvo pinito 400 grs,No,,FALSE,Dos Pinos Leche en polvo Pinito Bolsa 400 g,Dos Pinos,Leche en polvo Pinito,Bolsa 400 g,0
1968,dos pinos leche pinito entera en polvo bolsa 400 g,leche pinito en polvo do pinos 400 g 2060 7,No,,FALSE,Dos Pinos Leche en polvo Pinito Bolsa 400 g,Dos Pinos,Leche en polvo Pinito,Bolsa 400 g,0
1951,dos pinos leche semidescremada uht 1 l,leche delactomy do pinos semidescremada1 l 1132 7.2,No,,FALSE,Dos Pinos Leche semidescremada Delactomy Caja 1 L,Dos Pinos,Leche semidescremada Delactomy,Caja 1 L,0
1121,dos pinos mantequilla con sal barra 115 g,do pinos mantequilla do pinos barra 115 grs,No,,FALSE,Dos Pinos Mantequilla Empaque 115 g,Dos Pinos,Mantequilla,Empaque 115 g,0
2026,dos pinos mantequilla light pote 210 g,mantequilla light do pinos 210 g,No,,FALSE,Dos Pinos Mantequilla light Empaque 210 g,Dos Pinos,Mantequilla light,Empaque 210 g,0
2026,dos pinos mantequilla light pote 210 g,mantequilla light do pinos 210 g 8186 10.3,No,,FALSE,Dos Pinos Mantequilla light Empaque 210 g,Dos Pinos,Mantequilla light,Empaque 210 g,0
1692,dos pinos mini sandwich limón 48 g,helado mini sndwich do pinos 48 g 0646 2.3,No,,FALSE,Dos Pinos Helado mini sandwich Empaque 48 g,Dos Pinos,Helado mini sandwich,Empaque 48 g,0
1692,dos pinos mini sandwich limón 48 g,helado mini sndwich limn do pinos 48 g 8085 2.3,No,,FALSE,Dos Pinos Helado mini sandwich Empaque 48 g,Dos Pinos,Helado mini sandwich,Empaque 48 g,0
2133,dos pinos natilla liviana con sal la granja bolsa 500 g,do pinos natilla la granja doy pack 400g,No,,FALSE,Dos Pinos Natilla La Granja Doypack 400 g,Dos Pinos,Natilla La Granja,Doypack 400 g,0
2133,dos pinos natilla liviana con sal la granja bolsa 500 g,natilla la granja con sal do pinos 300 g 8728 1,No,,FALSE,Dos Pinos Natilla con sal La Granja Doypack 300 g,Dos Pinos,Natilla con sal La Granja,Doypack 300 g,0
2133,dos pinos natilla liviana con sal la granja bolsa 500 g,natilla la granja con sal do pinos 500 g 3869 2,No,,FALSE,Dos Pinos Natilla con sal La Granja Doypack 500 g,Dos Pinos,Natilla con sal La Granja,Doypack 500 g,0
2133,dos pinos natilla liviana con sal la granja bolsa 500 g,natilla la granja do pinos 300 g 8698 1,No,,FALSE,Dos Pinos Natilla La Granja Doypack 300 g,Dos Pinos,Natilla La Granja,Doypack 300 g,0
2133,dos pinos natilla liviana con sal la granja bolsa 500 g,natilla la granja do pinos 300g,No,,FALSE,Dos Pinos Natilla La Granja Doypack 300 g,Dos Pinos,Natilla La Granja,Doypack 300 g,0
2133,dos pinos natilla liviana con sal la granja bolsa 500 g,natilla la granja do pinos con sal 300g,No,,FALSE,Dos Pinos Natilla con sal La Granja Doypack 300 g,Dos Pinos,Natilla con sal La Granja,Doypack 300 g,0
1195,dos pinos queso americano procesado bolsa 128 g - 8 rebanadas,do pinos queso procesado americano 192 gr 12 reb,No,,FALSE,Dos Pinos Queso procesado americano Empaque 12 unid,Dos Pinos,Queso procesado americano,Empaque 12 unid,0
2477,dos pinos queso crema light 210 g,do pinos queso crema light do pinos 210 grs,No,,FALSE,Dos Pinos Queso crema light Empaque 210 g,Dos Pinos,Queso crema light,Empaque 210 g,0
2477,dos pinos queso crema light 210 g,do pinos queso crema original do pinos 210 grs,No,,FALSE,Dos Pinos Queso crema original Empaque 210 g,Dos Pinos,Queso crema original,Empaque 210 g,0
2477,dos pinos queso crema light 210 g,queso crema con pia do pinos 210 g 7394 10.3,No,,FALSE,Dos Pinos Queso crema con piña Empaque 210 g,Dos Pinos,Queso crema con piña,Empaque 210 g,0
