group_id,leader,member,modify_leader,image_url,label,canonical leader,brand,name,package ,promotion
270,atacand 32 mg x 14 tabletas,atacand 32 mg 14 tabletas,Yes,,True ,Atacand candesartán cilexetilo 32 mg 14 tabletas,Atacand,candesartán cilexetilo 32 mg,14 tabletas,0
270,atacand 32 mg x 14 tabletas,atacand 32 mg x 14 tabletas,Yes,,True ,Atacand candesartán cilexetilo 32 mg 14 tabletas,Atacand,candesartán cilexetilo 32 mg,14 tabletas,0
273,atacand plus 32 mg/25 mg 14 tabletas,atacand plus 32 mg25 mg 14 tabletas,No,,True ,atacand plus 32 mg/25 mg 14 tabletas,Atacand Plus,candesartán cilexetilo + hidroclorotiazida 32 mg/25 mg,14 tabletas,0
274,atacand plus 3212.5 mg x 14 comprimidos,atacand plus 3212.5 mg x 14 comprimidos,Yes,,True ,Atacand Plus candesartán cilexetilo + hidroclorotiazida32 mg/12.5 mg 14 comprimidos,Atacand Plus,candesartán cilexetilo + hidroclorotiazida32 mg/12.5 mg,14 comprimidos,0
340,bebida iced capuccino do pinos 250ml 4005 4.2,bebida iced capuccino do pinos 250ml 4005 4.2,Yes,,True ,Dos Pinos bebida iced capuccino 250 ml,Dos Pinos,bebida iced capuccino,250 ml,0
341,bebida iced mocca do pinos 250 ml 4012 4.2,bebida iced mocca do pinos 250 ml 4012 4.2,Yes,,True ,Dos Pinos bebida iced mocca 250 ml,Dos Pinos,bebida iced mocca,250 ml,0
342,bebida iced vainilla do pinos 250 ml 4029 4.2,bebida iced vainilla do pinos 250 ml 4029 4.2,Yes,,True ,Dos Pinos bebida iced vainilla 250 ml,Dos Pinos,bebida iced vainilla,250 ml,0
396,bolsa confite gallito surtido 900gr,bolsa confite gallito surtido 900gr,Yes,,True ,Gallito bolsa confite surtido 900 g,Gallito,bolsa confite surtido,900 g,0
404,brilinta 90 mg 60 comprimidos,brilinta 90 mg 30 comprimidos,Yes,,False ,Brilinta ticagrelor 90 mg 30 comprimidos,Brilinta,ticagrelor 90 mg,30 comprimidos,0
404,brilinta 90 mg 60 comprimidos,brilinta 90 mg 60 comprimidos,Yes,,True ,Brilinta ticagrelor 90 mg 60 comprimidos,Brilinta,ticagrelor 90 mg,60 comprimidos,0
405,brilinta 90 mg x 60 tabletas,brilinta 90 mg x 60 tabletas,Yes,,True ,Brilinta ticagrelor 90 mg 60 tabletas,Brilinta,ticagrelor 90 mg,60 tabletas,0
417,c. el gallito grande refresco natural,c. el gallito grande refresco natural,Yes,,True ,El Gallito refresco natural ,El Gallito,refresco natural,,0
570,chocolate gallito corazn almendra 100 gr desc 40 %,chocolate gallito corazn almendra 100 gr desc 15 %,Yes,,False ,Gallito chocolate corazón almendra desc 15 % 100 g,Gallito,chocolate corazón almendra desc 15 %,100 g,1
570,chocolate gallito corazn almendra 100 gr desc 40 %,chocolate gallito corazn almendra 100 gr desc 40 %,Yes,,True ,Gallito chocolate corazón almendra desc 40 % 100 g,Gallito,chocolate corazón almendra desc 40 %,100 g,1
572,chocolate gallito mlan relleno 12 unidades,chocolate gallito mlan relleno 12 unidades,Yes,,True ,Gallito chocolate milán relleno 12 unidades,Gallito,chocolate milán relleno,12 unidades,0
574,chocolate gallito rompopito 18 un 144 gr,chocolate gallito rompopito 18 un 144 gr,Yes,,True ,Gallito chocolate rompopito 144 g,Gallito,chocolate rompopito,144 g,0
575,chocolate gallito ron centenario,chocolate gallito ron centenario,Yes,,True ,Gallito chocolate ron centenario ,Gallito,chocolate ron centenario,,0
577,chocolate gallito tapita pie de manzana 40 gr,chocolate gallito tapita pie de manzana 40 gr,Yes,,True ,Gallito chocolate tapita pie de manzana 40 g,Gallito,chocolate tapita pie de manzana,40 g,0
578,chocolate gallito tapita tiramis 144g 20 % off,chocolate gallito tapita tiramis 144g 20 % off,Yes,,True ,Gallito chocolate tapita tiramisú 20% desc 144 g,Gallito,chocolate tapita tiramisú 20% desc,144 g,1
581,chocolate miln chocolate gallito 112.8 g 0287 3.7,chocolate miln chocolate gallito 112.8 g 0287 3.7,Yes,,True ,Gallito chocolate milán chocolate 112.8 g,Gallito,chocolate milán chocolate,112.8 g,0
641,combo 1 tropicl te blco.fru cer 2.5 bt 1 gallo pinto deli 500g 1 natilla do pinos con sal combo,combo 1 tropicl te blco.fru cer 2.5 bt 1 gallo pinto deli 500g 1 natilla do pinos con sal combo,Yes,,True ,Tropical combo té blanco + gallo pinto + natilla dos pinos con sal 3 unids,Tropical,combo té blanco + gallo pinto + natilla dos pinos con sal,3 unids,1
650,confite gallito morenito 50 unidades 210 gr,confite gallito menta 50 unidades 210 gramos,Yes,,False ,Gallito confite menta 210 g,Gallito,confite menta,210 g,0
650,confite gallito morenito 50 unidades 210 gr,confite gallito morenito 50 unidades 210 gr,Yes,,True ,Gallito confite morenito 210 g,Gallito,confite morenito,210 g,0
656,copa la estacin bola de helado de rompope gratis,copa la estacin bola de helado de rompope gratis,Yes,,True ,La Estación copa + bola de helado de rompope gratis 1 unid,La Estación,copa + bola de helado de rompope gratis,1 unid,1
657,copa la estacin bola pie de limn gratis,copa la estacin bola pie de limn gratis,Yes,,True ,La Estación copa + bola de helado pie de limón gratis 1 unid,La Estación,copa + bola de helado pie de limón gratis,1 unid,1
658,copa la estacin nieves,copa la estacin nieves,Yes,,True ,La Estación copa nieves ,La Estación,copa nieves,,0
714,crema dulce do pinos,crema dulce do pinos,Yes,,True ,Dos Pinos crema dulce ,Dos Pinos,crema dulce,,0
715,crema dulce do pinos 250 ml 4508 4.2,crema dulce do pinos 250 ml 4508 4.2,Yes,,True ,Dos Pinos crema dulce 250 ml,Dos Pinos,crema dulce,250 ml,0
718,crestor 10 mg 30 tabletas,crestor 10 mg 90 tabletas,No,,False ,Crestor rosuvastatina 10 mg 90 tabletas,Crestor,rosuvastatina 10 mg,90 tabletas,0
720,crestor 40 mg 30 tabletas,crestor 40 mg x 30 tabletas,No,,True ,crestor 40 mg 30 tabletas,Crestor,rosuvastatina 40 mg,30 tabletas,0
750,deli dog clsico t do pinos variedad 500 ml,deli dog clsico t do pinos variedad 500 ml,Yes,,True ,Dos Pinos combo deli dog clásico 1 unid,Dos Pinos,combo deli dog clásico,1 unid,1
757,deligurt fresa do pinos 125 g 4767 7.5,deligurt fresa do pinos 125 g 4767 7.5,Yes,,True ,Dos Pinos deligurt fresa 125 g,Dos Pinos,deligurt fresa,125 g,0
758,deligurt fresa do pinos 750 ml 2238 7.5,deligurt fresa do pinos 750 ml 2238 7.5,Yes,,True ,Dos Pinos deligurt fresa 750 ml,Dos Pinos,deligurt fresa,750 ml,0
765,desayuna con do pinos y la granja,desayuna con do pinos y la granja,Yes,,True ,Dos Pinos desayuna con dos pinos y la granja ,Dos Pinos,desayuna con dos pinos y la granja,,0
769,dip chipotle do pinos 210 g 0607 10.3,dip chipotle do pinos 210 g 0607 10.3,Yes,,True ,Dos Pinos dip chipotle 210 g,Dos Pinos,dip chipotle,210 g,0
770,dip do pinos de cebolla 23,dip do pinos de cebolla 23,Yes,,True ,Dos Pinos dip de cebolla ,Dos Pinos,dip de cebolla,,0
771,dip do pinos jamon serrano,dip do pinos jamon serrano,Yes,,True ,Dos Pinos dip jamón serrano 1 unid,Dos Pinos,dip jamón serrano,1 unid,0
772,dip jamn serrano do pinos 210g 0621 10.3,dip jamn serrano do pinos 210g 0621 10.3,Yes,,True ,Dos Pinos dip jamón serrano 210 g,Dos Pinos,dip jamón serrano,210 g,0
788,do pan pia simple 5 unidadesun paq natilla cremosita c sal del prado 300 grsun litro jugo de naranja do pinos,do pan pia c queso 5 unidadesun paq natilla cremosita c sal del prado 300 grsun litro jugo de naranja do pinos,Yes,,False ,Dos Pinos combo pan piña con queso + natilla cremosita + jugo de naranja 3 unids,Dos Pinos,combo pan piña con queso + natilla cremosita + jugo de naranja,3 unids,0
788,do pan pia simple 5 unidadesun paq natilla cremosita c sal del prado 300 grsun litro jugo de naranja do pinos,do pan pia simple 5 unidadesun paq natilla cremosita c sal del prado 300 grsun litro jugo de naranja do pinos,Yes,,True ,Dos Pinos combo pan piña simple + natilla cremosita + jugo de naranja 3 unids,Dos Pinos,combo pan piña simple + natilla cremosita + jugo de naranja,3 unids,0
789,do pan tipo france un queso crema do pinos 100 grs,do pan tipo france c ajonjoli un queso crema do pinos 100 grs,Yes,,False ,Dos Pinos pan tipo francés con ajonjolí y queso crema 100 g,Dos Pinos,pan tipo francés con ajonjolí y queso crema,100 g,0
789,do pan tipo france un queso crema do pinos 100 grs,do pan tipo france c queso un queso crema do pinos 100 grs,Yes,,True ,Dos Pinos pan tipo francés con queso crema 100 g,Dos Pinos,pan tipo francés con queso crema,100 g,0
789,do pan tipo france un queso crema do pinos 100 grs,do pan tipo france un queso crema do pinos 100 grs,Yes,,True ,Dos Pinos pan tipo francés con queso crema 100 g,Dos Pinos,pan tipo francés con queso crema,100 g,0
790,do pinos 2 pack helado coronado natilla fresa 14 gl desc 25 %,2 pack helado coronado cajeta 14 gl desc 25 %,Yes,,False ,Coronado helado cajeta desc 25% 2 unid x 1.13 L c/u,Coronado,helado cajeta desc 25%,2 unid x 1.13 L c/u,1
790,do pinos 2 pack helado coronado natilla fresa 14 gl desc 25 %,2 pack helado coronado cajeta 14gl desc 25 %,Yes,,False ,Coronado helado cajeta desc 25% 2 unid x 1.13 L c/u,Coronado,helado cajeta desc 25%,2 unid x 1.13 L c/u,1
790,do pinos 2 pack helado coronado natilla fresa 14 gl desc 25 %,2 pack helado coronado crema 14 gl desc 25 %,Yes,,False ,Coronado helado crema desc 25% 2 unid x 1.13 L c/u,Coronado,helado crema desc 25%,2 unid x 1.13 L c/u,1
790,do pinos 2 pack helado coronado natilla fresa 14 gl desc 25 %,2 pack helado coronado frutas 14 gl desc 25 %,Yes,,False ,Coronado helado frutas desc 25% 2 unid x 1.13 L c/u,Coronado,helado frutas desc 25%,2 unid x 1.13 L c/u,1
790,do pinos 2 pack helado coronado natilla fresa 14 gl desc 25 %,2 pack helado coronado frutas 14gl desc 25 %,Yes,,False ,Coronado helado frutas desc 25% 2 unid x 1.13 L c/u,Coronado,helado frutas desc 25%,2 unid x 1.13 L c/u,1
790,do pinos 2 pack helado coronado natilla fresa 14 gl desc 25 %,2 pack helado coronado man 14 gl desc 25 %,Yes,,False ,Coronado helado man desc 25% 2 unid x 1.13 L c/u,Coronado,helado man desc 25%,2 unid x 1.13 L c/u,1
790,do pinos 2 pack helado coronado natilla fresa 14 gl desc 25 %,2 pack helado coronado natilla con fresa 1 4 gl desc 40 %,Yes,,False ,Coronado helado natilla con fresa desc 40% 2 unid x 1.13 L c/u,Coronado,helado natilla con fresa desc 40%,2 unid x 1.13 L c/u,1
790,do pinos 2 pack helado coronado natilla fresa 14 gl desc 25 %,2 pack helado coronado natilla con fresa 14 gl desc 40 %,Yes,,False ,Coronado helado natilla con fresa desc 40% 2 unid x 1.13 L c/u,Coronado,helado natilla con fresa desc 40%,2 unid x 1.13 L c/u,1
790,do pinos 2 pack helado coronado natilla fresa 14 gl desc 25 %,2 pack helado coronado natilla fresa 14 gl desc 25 %,Yes,,False ,Coronado helado natilla fresa desc 25% 2 unid x 1.13 L c/u,Coronado,helado natilla fresa desc 25%,2 unid x 1.13 L c/u,1
790,do pinos 2 pack helado coronado natilla fresa 14 gl desc 25 %,do pinos 2 pack helado coronado natilla fresa 14 gl desc 25 %,Yes,,True ,Dos Pinos helado coronado natilla fresa desc 25% 2 unid x 1.13 L c/u,Dos Pinos,helado coronado natilla fresa desc 25%,2 unid x 1.13 L c/u,1
791,do pinos 2 pack helado deleite naranja holandesa 14 gl desc 45 %,do pinos 2 pack helado deleite naranja holandesa 14 gl desc 45 %,Yes,,True ,Dos Pinos helado deleite naranja holandesa desc 45% 2 unid x 1.13 L c/u,Dos Pinos,helado deleite naranja holandesa desc 45%,2 unid x 1.13 L c/u,1
792,do pinos 2 pack helado gallito miln menta 14 gl desc 40 %,2 pack helado gallito milan menta 14 gl desc 40 %,Yes,,False ,Gallito helado milán menta desc 40% 2 unid x 1.13 L c/u,Gallito,helado milán menta desc 40%,2 unid x 1.13 L c/u,1
792,do pinos 2 pack helado gallito miln menta 14 gl desc 40 %,2 pack helado gallito milan menta 14 gl desc 50 %,Yes,,False ,Gallito helado milán menta desc 50% 2 unid x 1.13 L c/u,Gallito,helado milán menta desc 50%,2 unid x 1.13 L c/u,1
792,do pinos 2 pack helado gallito miln menta 14 gl desc 40 %,2 pack helado gallito milan menta 14gl,Yes,,False ,Gallito helado milán menta 2 unid x 1.13 L c/u,Gallito,helado milán menta,2 unid x 1.13 L c/u,0
792,do pinos 2 pack helado gallito miln menta 14 gl desc 40 %,2 pack helado gallito milan menta 14gl desc 40 %,Yes,,False ,Gallito helado milán menta desc 40% 2 unid x 1.13 L c/u,Gallito,helado milán menta desc 40%,2 unid x 1.13 L c/u,1
792,do pinos 2 pack helado gallito miln menta 14 gl desc 40 %,2 pack helado gallito milan menta 14gl desc 50 %,Yes,,False ,Gallito helado milán menta desc 50% 2 unid x 1.13 L c/u,Gallito,helado milán menta desc 50%,2 unid x 1.13 L c/u,1
792,do pinos 2 pack helado gallito miln menta 14 gl desc 40 %,2 pack helado gallito milan menta 540g 14 gl,Yes,,False ,Gallito helado milán menta 2 unid x 1.13 L c/u,Gallito,helado milán menta,2 unid x 1.13 L c/u,0
792,do pinos 2 pack helado gallito miln menta 14 gl desc 40 %,2 pack helado gallito miln menta 14 gl,Yes,,False ,Gallito helado milán menta 2 unid x 1.13 L c/u,Gallito,helado milán menta,2 unid x 1.13 L c/u,0
792,do pinos 2 pack helado gallito miln menta 14 gl desc 40 %,2 pack helado gallito miln menta 14 gl desc 30 %,Yes,,False ,Gallito helado milán menta desc 30% 2 unid x 1.13 L c/u,Gallito,helado milán menta desc 30%,2 unid x 1.13 L c/u,1
792,do pinos 2 pack helado gallito miln menta 14 gl desc 40 %,2 pack helado gallito miln menta 14 gl desc 40 %,Yes,,False ,Gallito helado milán menta desc 40% 2 unid x 1.13 L c/u,Gallito,helado milán menta desc 40%,2 unid x 1.13 L c/u,1
792,do pinos 2 pack helado gallito miln menta 14 gl desc 40 %,3 pack helado gallito milan menta 540g 14 gl desc gl 30 %,Yes,,False ,Gallito helado milán menta desc 30% 3 unid x 1.13 L c/u,Gallito,helado milán menta desc 30%,3 unid x 1.13 L c/u,1
792,do pinos 2 pack helado gallito miln menta 14 gl desc 40 %,3 pack helado gallito miln menta 14 gl desc 30 %,Yes,,False ,Gallito helado milán menta desc 30% 3 unid x 1.13 L c/u,Gallito,helado milán menta desc 30%,3 unid x 1.13 L c/u,1
792,do pinos 2 pack helado gallito miln menta 14 gl desc 40 %,3 pack helado gallito miln menta 14 gl desc 33 %,Yes,,False ,Gallito helado milán menta desc 33% 3 unid x 1.13 L c/u,Gallito,helado milán menta desc 33%,3 unid x 1.13 L c/u,1
792,do pinos 2 pack helado gallito miln menta 14 gl desc 40 %,do pinos 2 pack helado gallito miln menta 14 gl desc 40 %,Yes,,True ,Dos Pinos helado gallito milán menta desc 40% 2 unid x 1.13 L c/u,Dos Pinos,helado gallito milán menta desc 40%,2 unid x 1.13 L c/u,1
793,do pinos 2 pack jugo manzana 100 % lt desc 20 %,do pinos 2 pack jugo manzana 100 % lt desc 20 %,Yes,,True ,Dos Pinos jugo manzana 100% desc 20% 2 unid x 1 L c/u,Dos Pinos,jugo manzana 100% desc 20%,2 unid x 1 L c/u,1
794,do pinos 2 pack natilla la granja 400 gr doy pack desc 35 %,do pinos 2 pack natilla la granja 400 gr doy pack desc 35 %,Yes,,True ,Dos Pinos natilla la granja desc 35 % 2 unid x 400 g c/u,Dos Pinos,natilla la granja desc 35 %,2 unid x 400 g c/u,1
795,do pinos 2 pack nctar manzana y melocotn lt desc 25 %,do pinos 2 pack nctar manzana y melocotn lt desc 25 %,Yes,,True ,Dos Pinos néctar manzana y melocotón desc 25 % 2 unid x 1 L c/u,Dos Pinos,néctar manzana y melocotón desc 25 %,2 unid x 1 L c/u,1
796,do pinos 2 pack queso crema pia 210 gr desc 30 %,do pinos 2 pack queso crema 210 gr desc 30 %,Yes,,False ,Dos Pinos queso crema desc 30% 2 unid x 210 g c/u,Dos Pinos,queso crema desc 30%,2 unid x 210 g c/u,1
796,do pinos 2 pack queso crema pia 210 gr desc 30 %,do pinos 2 pack queso crema pia 210 gr desc 30 %,Yes,,True ,Dos Pinos queso crema piña desc 30% 2 unid x 210 g c/u,Dos Pinos,queso crema piña desc 30%,2 unid x 210 g c/u,1
797,do pinos 2 pack yogurt delactomy fresa 750 ml desc 35 %,do pinos 2 pack yogurt delactomy fresa 750 ml desc 35 %,Yes,,True ,Dos Pinos yogurt delactomy fresa desc 35 % 2 unid x 750 ml c/u,Dos Pinos,yogurt delactomy fresa desc 35 %,2 unid x 750 ml c/u,1
798,do pinos 2x1 chocolate minitapitas bolsa 49 gr,do pinos 2x1 chocolate minitapitas bolsa 49 gr,Yes,,True ,Dos Pinos 2 x 1 chocolate minitapitas Bolsa 49 g,Dos Pinos,2 x 1 chocolate minitapitas,Bolsa 49 g,1
799,do pinos 2x1 helado chocolate con ron 14 g,do pinos 2x1 helado chocolate con ron 14 g,Yes,,True ,Dos Pinos 2 x 1 helado chocolate con ron 1.13 L,Dos Pinos,2 x 1 helado chocolate con ron,1.13 L,1
800,do pinos 2x1 helado napolitano 14 gl,do pinos 2x1 helado napolitano 14 gl,Yes,,True ,Dos Pinos 2 x 1 helado napolitano 1.13 L,Dos Pinos,2 x 1 helado napolitano,1.13 L,1
801,do pinos 2x1 queso procesado americano 192 gr 12 reb,do pinos 2x1 queso procesado americano 192 gr 12 reb,Yes,,True ,Dos Pinos 2 x 1 queso procesado americano 12 reb 192 g,Dos Pinos,2 x 1 queso procesado americano 12 reb,192 g,1
802,do pinos 4 pack yogurt lquido griego plus almendra 200 ml desc 25 %,do pinos 4 pack yogurt lquido griego plus almendra 200 ml desc 25 %,Yes,,True ,Dos Pinos yogurt lquido griego plus almendra 200 ml desc 25 % 4 unids x 200 ml c/u,Dos Pinos,yogurt lquido griego plus almendra 200 ml desc 25 %,4 unids x 200 ml c/u,1
803,do pinos 4 pack yogurt lula topping confitado 120 gr,do pinos 4 pack yogurt lula topping confitado 120 gr,Yes,,True ,Dos Pinos yogurt lula topping confitado 4 unids x 120 g c/u,Dos Pinos,yogurt lula topping confitado,4 unids x 120 g c/u,0
804,do pinos 4 pack yogurt lula topping pecaditos 120 gr,do pinos 4 pack yogurt lula topping pecaditos 120 gr,Yes,,True ,Dos Pinos yogurt lula topping pecaditos 4 unids x 120 g c/u,Dos Pinos,yogurt lula topping pecaditos,4 unids x 120 g c/u,0
805,do pinos 6pack leche uht crec junior lt desc 22 %,do pinos 6pack leche uht crec junior lt desc 22 %,Yes,,True ,Dos Pinos leche uht cre-c junior desc 22 % 6 unids x 1 L c/u,Dos Pinos,leche uht cre-c junior desc 22 %,6 unids x 1 L c/u,1
806,do pinos 8 pack leche coronado uht 3.5 lt desc 15 %,8 pack leche coronado uht 3.5 % lt desc 15 %,Yes,,False ,Coronado leche uht 3.5% desc 15% 8 unids x 1 L c/u,Coronado,leche uht 3.5% desc 15%,8 unids x 1 L c/u,1
806,do pinos 8 pack leche coronado uht 3.5 lt desc 15 %,8 pack leche coronado uht 3.5 lt desc 15 %,Yes,,False ,Coronado leche uht desc 15% 8 unids x 3.5 L c/u,Coronado,leche uht desc 15%,8 unids x 3.5 L c/u,1
806,do pinos 8 pack leche coronado uht 3.5 lt desc 15 %,8 pack leche coronado uht 3.5 lt desc 25 %,Yes,,False ,Coronado leche uht desc 25% 8 unids x 3.5 L c/u,Coronado,leche uht desc 25%,8 unids x 3.5 L c/u,1
806,do pinos 8 pack leche coronado uht 3.5 lt desc 15 %,8 pack leche coronado uht 3.5 lt descuento 25 %,Yes,,False ,Coronado leche uht descuento 25% 8 unids x 3.5 L c/u,Coronado,leche uht descuento 25%,8 unids x 3.5 L c/u,1
806,do pinos 8 pack leche coronado uht 3.5 lt desc 15 %,do pinos 8 pack leche coronado uht 3.5 lt desc 15 %,Yes,,True ,Dos Pinos leche coronado uht desc 15% 8 unids x 3.5 L c/u,Dos Pinos,leche coronado uht desc 15%,8 unids x 3.5 L c/u,1
807,do pinos agua alma perasandia 600ml,do pinos agua alma perasandia 600ml,Yes,,True ,Dos Pinos agua alma pera sandía 600 ml,Dos Pinos,agua alma pera sandía,600 ml,0
808,do pinos cafe frio moka britt 250 ml uht,do pinos cafe frio moka britt 250 ml uht,Yes,,True ,Dos Pinos café frío moka britt uht 250 ml,Dos Pinos,café frío moka britt uht,250 ml,0
810,do pinos cafe fro vainilla britt 250 ml uht,do pinos cafe fro vainilla britt 250 ml uht,Yes,,True ,Dos Pinos café frío vainilla britt uht 250 ml,Dos Pinos,café frío vainilla britt uht,250 ml,0
811,do pinos chocolate gallito caja surtida 330 gr desc 15 %,chocolate gallito caja surtida 330 gr desc 15 %,Yes,,False ,Gallito chocolate caja surtida desc 15% 330 g,Gallito,chocolate caja surtida desc 15%,330 g,1
811,do pinos chocolate gallito caja surtida 330 gr desc 15 %,chocolate gallito caja surtida 330 gr desc 40 %,Yes,,False ,Gallito chocolate caja surtida desc 40% 330 g,Gallito,chocolate caja surtida desc 40%,330 g,1
811,do pinos chocolate gallito caja surtida 330 gr desc 15 %,chocolate gallito caja surtida 330g desc 15 %,Yes,,False ,Gallito chocolate caja surtida desc 15% 330 g,Gallito,chocolate caja surtida desc 15%,330 g,1
811,do pinos chocolate gallito caja surtida 330 gr desc 15 %,chocolate gallito caja surtida 330g desc 50 %,Yes,,False ,Gallito chocolate caja surtida desc 50% 330 g,Gallito,chocolate caja surtida desc 50%,330 g,1
811,do pinos chocolate gallito caja surtida 330 gr desc 15 %,do pinos chocolate gallito caja surtida 330 gr desc 15 %,Yes,,True ,Dos Pinos chocolate gallito caja surtida desc 15% 330 g,Dos Pinos,chocolate gallito caja surtida desc 15%,330 g,1
812,do pinos chocoleche 1l 20 % desc,do pinos chocoleche 1l 20 % desc,Yes,,True ,Dos Pinos chocoleche 20% desc 1 L,Dos Pinos,chocoleche 20% desc,1 L,1
813,do pinos cono krunchy krips 6 pack,do pinos cono krunchy krips 6 pack,Yes,,True ,Dos Pinos cono krunchy krips 6 units,Dos Pinos,cono krunchy krips,6 units,0
814,do pinos cotuba cero 2 lt desc 20 %,do pinos cotuba cero 2 lt desc 20 %,Yes,,True ,Dos Pinos cotuba cero bebida guaraná desc 20% 2 L,Dos Pinos,cotuba cero bebida guaraná desc 20%,2 L,1
815,do pinos cotuba original 2 lt desc 20 %,do pinos cotuba original 2 lt desc 20 %,Yes,,True ,Dos Pinos cotuba original desc 20% 2 L,Dos Pinos,cotuba original desc 20%,2 L,1
816,do pinos delactomy leche 50 % proteina caja 250 ml,do pinos delactomy leche 50 % proteina caja 250 ml,Yes,,True ,Dos Pinos delactomy leche 50% proteína 250 ml,Dos Pinos,delactomy leche 50% proteína,250 ml,0
819,do pinos deligurt batido natural 125 gr,do pinos deligurt batido natural 125 gr,Yes,,True ,Dos Pinos deligurt batido natural 125 g,Dos Pinos,deligurt batido natural,125 g,0
823,do pinos dip de cebolla 230 gr taza desc 17 %,do pinos dip de cebolla 230 gr desc 17 %,Yes,,True ,Dos Pinos dip de cebolla desc 17 % 230 g,Dos Pinos,dip de cebolla desc 17 %,230 g,1
823,do pinos dip de cebolla 230 gr taza desc 17 %,do pinos dip de cebolla 230 gr taza desc 17 %,Yes,,True ,Dos Pinos dip de cebolla desc 17 % 230 g,Dos Pinos,dip de cebolla desc 17 %,230 g,1
827,do pinos frescoleche do pinos fresa litro,do pinos frescoleche do pinos fresa litro,Yes,,True ,Dos Pinos fresco leche fresa 1 L,Dos Pinos,fresco leche fresa,1 L,0
829,do pinos frescoleche surtido 250ml 6 pack,do pinos frescoleche surtido 250ml 6 pack,Yes,,True ,Dos Pinos fresco leche surtido 6 units x 250 ml c/u,Dos Pinos,fresco leche surtido,6 units x 250 ml c/u,0
832,do pinos helado chocolate con ron 14 gl,do pinos helado chocolate con ron 14 gl,Yes,,True ,Dos Pinos helado chocolate con ron 1.13 L,Dos Pinos,helado chocolate con ron,1.13 L,0
834,do pinos helado combinado de limn 14 gl,do pinos helado combinado de limn 14 gl,Yes,,True ,Dos Pinos helado combinado de limón 1.13 L,Dos Pinos,helado combinado de limón,1.13 L,0
836,do pinos helado cono caramelo macadamia deleite 75 grs,do pinos helado cono caramelo macadamia deleite 75 grs,Yes,,True ,Dos Pinos helado cono caramelo macadamia deleite 75 g,Dos Pinos,helado cono caramelo macadamia deleite,75 g,0
837,do pinos helado cremoleta fresa do pinos 75 grs,do pinos helado chocoleta do pinos 75 grs,Yes,,False ,Dos Pinos helado chocoleta 75 g,Dos Pinos,helado chocoleta,75 g,0
837,do pinos helado cremoleta fresa do pinos 75 grs,do pinos helado cremoleta fresa do pinos 75 grs,Yes,,True ,Dos Pinos helado cremoleta fresa 75 g,Dos Pinos,helado cremoleta fresa,75 g,0
842,do pinos helado krunchi krips do pinos 75 grs,do pinos helado krunchi krips do pinos 75 grs,Yes,,True ,Dos Pinos helado krunchi krips 75 g,Dos Pinos,helado krunchi krips,75 g,0
845,do pinos helado protena coco 1 pinta,do pinos helado protena chocochips 1 pinta,Yes,,False ,Dos Pinos helado proteína chocochips 473 ml,Dos Pinos,helado proteína chocochips,473 ml,0
845,do pinos helado protena coco 1 pinta,do pinos helado protena coco 1 pinta,Yes,,True ,Dos Pinos helado proteína coco 473 ml,Dos Pinos,helado proteína coco,473 ml,0
846,do pinos helado protena leche condensada fresa 252 gr,do pinos helado protena leche condensada fresa 252 gr,Yes,,True ,Dos Pinos helado proteína leche condensada fresa 252 g,Dos Pinos,helado proteína leche condensada fresa,252 g,0
847,do pinos helado rompope 14 gl,do pinos helado rompope 14 gl,Yes,,True ,Dos Pinos helado rompope 1.13 L,Dos Pinos,helado rompope,1.13 L,0
851,do pinos helado trits limon galleta 14 gl,do pinos helado trits limon galleta 14 gl,Yes,,True ,Dos Pinos helado trits limón galleta 1.13 L,Dos Pinos,helado trits limón galleta,1.13 L,0
856,do pinos jugo de naranja do pinos litro,do pinos jugo de naranja c zanahoria do pinos litro,Yes,,False ,Dos Pinos jugo de naranja con zanahoria 1 L,Dos Pinos,jugo de naranja con zanahoria,1 L,0
856,do pinos jugo de naranja do pinos litro,do pinos jugo de naranja do pinos litro,Yes,,True ,Dos Pinos jugo de naranja 1 L,Dos Pinos,jugo de naranja,1 L,0
857,do pinos jugo naranja maracuy 946 ml desc 20 %,do pinos jugo naranja maracuy 946 ml desc 20 %,Yes,,True ,Dos Pinos jugo naranja maracuyá desc 20% 946 ml,Dos Pinos,jugo naranja maracuyá desc 20%,946 ml,1
858,do pinos krunchy torta chilena 75g,do pinos krunchy torta chilena 75g,Yes,,True ,Dos Pinos krunchy torta chilena 75 g,Dos Pinos,krunchy torta chilena,75 g,0
862,do pinos leche delactomy fresa do pinos 250 ml,do pinos leche delactomy fresa do pinos 250 ml,Yes,,True ,Dos Pinos leche delactomy fresa 250 ml,Dos Pinos,leche delactomy fresa,250 ml,0
863,do pinos leche delactomy vainilla do pinos 250 ml,do pinos leche delactomy vainilla do pinos 250 ml,Yes,,True ,Dos Pinos leche delactomy vainilla 250 ml,Dos Pinos,leche delactomy vainilla,250 ml,0
866,do pinos leche do pinos uht 50 % proteina litro,do pinos leche do pinos uht 50 % proteina litro,Yes,,True ,Dos Pinos leche uht 50% proteína 1 L,Dos Pinos,leche uht 50% proteína,1 L,0
867,do pinos leche en polvo pinito 120 g,do pinos leche en polvo pinito 120 g,Yes,,True ,Dos Pinos leche en polvo pinito 120 g,Dos Pinos,leche en polvo pinito,120 g,0
869,do pinos leche galon do pinos 3.75 lts,do pinos leche galon do pinos 3.75 lts,Yes,,True ,Dos Pinos leche 3.75 L,Dos Pinos,leche,3.75 L,0
